{
  "version": "1",
  "generatedAt": "2026-09-17T08:00:00-06:00",
  "timezone": "America/Denver",
  "quiet": true,
  "materialChanged": false,
  "shipping": [],
  "blocked": [],
  "needsOperator": [],
  "sourcesPolled": ["print-hive", "fleet", "ops", "hive-mcp"],
  "notes": "Nothing material changed"
}
